01:54:09.141437 IP 172.16.91.100.51712 > 172.16.91.10.domain: 1+ PTR? 10.91.16.172.in-addr.arpa. (43)
01:54:11.137261 IP 172.16.91.100.51713 > 172.16.91.10.domain: 2+ A? 716l6yh0.akstat.io. (36)
01:54:13.144349 IP 172.16.91.100.51714 > 172.16.91.10.domain: 3+ AAAA? 716l6yh0.akstat.io. (36)
01:54:15.145417 IP 172.16.91.100.51715 > 172.16.91.10.domain: 4+ A? 716l6yh0.akstat.io. (36)
01:54:17.151963 IP 172.16.91.100.51716 > 172.16.91.10.domain: 5+ AAAA? 716l6yh0.akstat.io. (36)
01:54:20.236441 IP 172.16.91.100.51717 > 172.16.91.10.domain: 1+ PTR? 10.91.16.172.in-addr.arpa. (43)
01:54:21.696334 IP 172.16.91.100.51718 > 172.16.91.10.domain: 2+ A? 84z90nn0.akstat.io. (36)
01:54:23.710836 IP 172.16.91.100.51719 > 172.16.91.10.domain: 3+ AAAA? 84z90nn0.akstat.io. (36)
01:54:25.715573 IP 172.16.91.100.51720 > 172.16.91.10.domain: 4+ A? 84z90nn0.akstat.io. (36)
01:54:27.715668 IP 172.16.91.100.51721 > 172.16.91.10.domain: 5+ AAAA? 84z90nn0.akstat.io. (36)
01:54:30.250227 IP 172.16.91.100.51722 > 172.16.91.10.domain: 1+ PTR? 10.91.16.172.in-addr.arpa. (43)
01:54:32.254488 IP 172.16.91.100.51723 > 172.16.91.10.domain: 2+ A? 216zfd3x.akstat.io. (36)
01:54:34.254266 IP 172.16.91.100.51724 > 172.16.91.10.domain: 3+ AAAA? 216zfd3x.akstat.io. (36)
01:54:36.254630 IP 172.16.91.100.51725 > 172.16.91.10.domain: 4+ A? 216zfd3x.akstat.io. (36)
01:54:38.268024 IP 172.16.91.100.51726 > 172.16.91.10.domain: 5+ AAAA? 216zfd3x.akstat.io. (36)
01:54:40.813080 IP 172.16.91.100.51727 > 172.16.91.10.domain: 1+ PTR? 10.91.16.172.in-addr.arpa. (43)
01:54:42.813021 IP 172.16.91.100.51728 > 172.16.91.10.domain: 2+ A? 11g6bdvj.akstat.io. (36)
01:54:44.826696 IP 172.16.91.100.51729 > 172.16.91.10.domain: 3+ AAAA? 11g6bdvj.akstat.io. (36)
01:54:46.838703 IP 172.16.91.100.51730 > 172.16.91.10.domain: 4+ A? 11g6bdvj.akstat.io. (36)
01:54:48.839179 IP 172.16.91.100.63154 > 172.16.91.10.domain: 5+ AAAA? 11g6bdvj.akstat.io. (36)
01:54:51.379477 IP 172.16.91.100.63155 > 172.16.91.10.domain: 1+ PTR? 10.91.16.172.in-addr.arpa. (43)
01:54:53.375453 IP 172.16.91.100.63156 > 172.16.91.10.domain: 2+ A? 32el4fp9.akstat.io. (36)
01:54:55.375780 IP 172.16.91.100.63157 > 172.16.91.10.domain: 3+ AAAA? 32el4fp9.akstat.io. (36)
01:54:57.376251 IP 172.16.91.100.63158 > 172.16.91.10.domain: 4+ A? 32el4fp9.akstat.io. (36)
01:54:59.388135 IP 172.16.91.100.63159 > 172.16.91.10.domain: 5+ AAAA? 32el4fp9.akstat.io. (36)
01:55:01.920471 IP 172.16.91.100.63160 > 172.16.91.10.domain: 1+ PTR? 10.91.16.172.in-addr.arpa. (43)
01:55:03.924223 IP 172.16.91.100.63161 > 172.16.91.10.domain: 2+ A? 84z9ugkn.akstat.io. (36)
01:55:05.923794 IP 172.16.91.100.63162 > 172.16.91.10.domain: 3+ AAAA? 84z9ugkn.akstat.io. (36)
01:55:07.938918 IP 172.16.91.100.63163 > 172.16.91.10.domain: 4+ A? 84z9ugkn.akstat.io. (36)
01:55:09.954166 IP 172.16.91.100.63164 > 172.16.91.10.domain: 5+ AAAA? 84z9ugkn.akstat.io. (36)
01:55:12.471826 IP 172.16.91.100.63165 > 172.16.91.10.domain: 1+ PTR? 10.91.16.172.in-addr.arpa. (43)
01:55:14.482119 IP 172.16.91.100.63166 > 172.16.91.10.domain: 2+ A? 95xgcqai.akstat.io. (36)
01:55:16.486702 IP 172.16.91.100.63167 > 172.16.91.10.domain: 3+ AAAA? 95xgcqai.akstat.io. (36)
01:55:18.502232 IP 172.16.91.100.63168 > 172.16.91.10.domain: 4+ A? 95xgcqai.akstat.io. (36)
01:55:20.516115 IP 172.16.91.100.63169 > 172.16.91.10.domain: 5+ AAAA? 95xgcqai.akstat.io. (36)
01:55:23.039913 IP 172.16.91.100.63170 > 172.16.91.10.domain: 1+ PTR? 10.91.16.172.in-addr.arpa. (43)
01:55:25.053370 IP 172.16.91.100.63171 > 172.16.91.10.domain: 2+ A? 66jc3r9d.akstat.io. (36)
01:55:27.068641 IP 172.16.91.100.63172 > 172.16.91.10.domain: 3+ AAAA? 66jc3r9d.akstat.io. (36)
01:55:29.068663 IP 172.16.91.100.63173 > 172.16.91.10.domain: 4+ A? 66jc3r9d.akstat.io. (36)
01:55:31.069006 IP 172.16.91.100.63174 > 172.16.91.10.domain: 5+ AAAA? 66jc3r9d.akstat.io. (36)
